{
  "vendor": "rakwireless",
  "model": "rak7289v2",
  "name": "RAK7289V2 WisGate Edge Pro",
  "regions": [
    "EU868",
    "US915",
    "AU915"
  ],
  "chipset": "SX1303 (up to two concentrators)",
  "oui": [
    "AC1F09"
  ],
  "admin": {
    "defaultUrl": "http://192.168.230.1",
    "apModeSsid": "RAK7289V2_XXXX",
    "defaultCredentials": null,
    "credentialsNote": "WisGateOS 2: log in as user `root` and set a new password on first boot (>=12 chars incl. a number, a letter, and a special char) — there is no factory default password."
  },
  "configMethods": [
    "web-ui"
  ],
  "packetForwarders": [
    "semtech-udp",
    "basics-station"
  ],
  "config": {
    "semtech-udp": {
      "template": "config/semtech-udp.tmpl.json"
    },
    "basics-station": {
      "template": "config/basics-station.tmpl.conf"
    },
    "web-ui": {
      "path": "LoRa → LoRa Configuration (Work Mode: Packet Forwarder)"
    }
  },
  "variantOf": null,
  "provenance": {
    "source": "vendor-docs",
    "url": "https://docs.rakwireless.com/product-categories/wisgate/rak7289v2/overview/",
    "sha256": "6e158021056500f874283ca69b86cedc3b8b625ad3cd80a21050e64ab13f6dc7",
    "referencedAt": "2026-07-16"
  },
  "draft": false
}
