{
  "vendor": "dragino",
  "model": "lg308n",
  "name": "LG308N Indoor LoRaWAN Gateway",
  "regions": [
    "EU868",
    "US915"
  ],
  "chipset": "SX1302",
  "oui": [
    "A84041"
  ],
  "admin": {
    "defaultUrl": "http://10.130.1.1",
    "apModeSsid": "dragino-XXXXXX",
    "defaultCredentials": {
      "username": "root",
      "password": "dragino"
    },
    "credentialsNote": "LuCI (OpenWrt) default; change it on first login. 10.130.1.1 is the Wi-Fi AP-mode IP (SSID dragino-xxxxxx, Wi-Fi password dragino+dragino); over Ethernet, browse to the DHCP-assigned IP on port 8000. Verify against the model manual."
  },
  "configMethods": [
    "web-ui",
    "ssh-cli",
    "forwarder-file"
  ],
  "packetForwarders": [
    "semtech-udp"
  ],
  "config": {
    "semtech-udp": {
      "template": "config/semtech-udp.tmpl.json",
      "forwarderFilePath": "/etc/lora/global_conf.json"
    },
    "web-ui": {
      "path": "LoRaWAN → LoRaWAN Semtech UDP"
    }
  },
  "variantOf": null,
  "provenance": {
    "source": "vendor-docs",
    "url": "https://www.dragino.com/products/lora-lorawan-gateway/item/229-lg308n.html",
    "sha256": "20e98a7df6ec4b0d6fe134ea5642c8c2188428f1ee309a89552ca1b474533062",
    "referencedAt": "2026-07-16"
  },
  "draft": false
}
