{
  "vendor": "rakwireless",
  "model": "rak7266",
  "name": "RAK7266 WisGate Soho Lite",
  "regions": [
    "EU868",
    "US915"
  ],
  "chipset": "SX1302",
  "oui": [
    "AC1F09"
  ],
  "admin": {
    "defaultUrl": "http://192.168.230.1",
    "apModeSsid": "RAK7266_XXXX",
    "defaultCredentials": null,
    "credentialsNote": "WisGateOS 2: log in as user `root` and set a new password on first boot (>=12 chars incl. a number, a letter, and a special char) — there is no factory default password."
  },
  "configMethods": [
    "web-ui"
  ],
  "packetForwarders": [
    "semtech-udp",
    "basics-station"
  ],
  "config": {
    "semtech-udp": {
      "template": "config/semtech-udp.tmpl.json"
    },
    "basics-station": {
      "template": "config/basics-station.tmpl.conf"
    },
    "web-ui": {
      "path": "LoRa → LoRa Configuration (Work Mode: Packet Forwarder)"
    }
  },
  "variantOf": null,
  "provenance": {
    "source": "vendor-docs",
    "url": "https://docs.rakwireless.com/product-categories/wisgate/rak7266/datasheet/",
    "sha256": "a7aa6002ae2f0be7f24228077dc7ca1df1ffa0ba33241a983b2608e518d45c90",
    "referencedAt": "2026-07-16"
  },
  "draft": false
}
