{
  "vendor": "rakwireless",
  "model": "rak7285",
  "name": "RAK7285 WisGate Edge Ultra",
  "regions": [
    "EU868",
    "US915"
  ],
  "chipset": "SX1303",
  "oui": [
    "AC1F09"
  ],
  "admin": {
    "defaultUrl": "http://192.168.230.1",
    "apModeSsid": "RAK7285_XXXX",
    "defaultCredentials": null,
    "credentialsNote": "WisGateOS 2: log in as user `root` and set a new password on first boot — there is no factory default password. The AP-mode SSID also appears as RAK7285C_XXXX on the LTE (C) variant."
  },
  "configMethods": [
    "web-ui"
  ],
  "packetForwarders": [
    "semtech-udp",
    "basics-station"
  ],
  "config": {
    "semtech-udp": {
      "template": "config/semtech-udp.tmpl.json"
    },
    "basics-station": {
      "template": "config/basics-station.tmpl.conf"
    },
    "web-ui": {
      "path": "LoRa Network → Network Settings (Work Mode: Packet Forwarder)"
    }
  },
  "variantOf": null,
  "provenance": {
    "source": "vendor-docs",
    "url": "https://docs.rakwireless.com/product-categories/wisgate/rak7285/overview/",
    "sha256": "97dfd815f21fbca8d9f0ae405ff0132d774b3d2cd81747daca5bdc308d0c63e3",
    "referencedAt": "2026-07-16"
  },
  "draft": false
}
